{
  "slug": "rugatelstva-anime",
  "type": "lexicon",
  "title": "Как ругаются в японских аниме",
  "image": "/images/covers/rugatelstva-anime.png",
  "cover": "/images/covers/rugatelstva-anime.png",
  "backHref": "/",
  "toc": [
    { "id": "intro", "label": "Введение" },
    { "id": "baka", "label": "1. バカ (baka) — король оскорблений" },
    { "id": "aho", "label": "2. アホ (aho) — западный вариант" },
    { "id": "kuso", "label": "3. くそ (kuso) — универсальный выразитель эмоций" },
    { "id": "kono-yaro", "label": "4. この野郎 (kono yarō) — «ты, парень...»" },
    { "id": "shine", "label": "5. 死ね (shine) — «сдохни»" },
    { "id": "test", "label": "Проверка себя" }
  ],
  "links": [{ "href": "#", "label": "Список слов из статьи" }],
  "introduction": "Японцы редко матерятся в нашем понимании. У них нет аналога русского мата. Но это не значит, что они не могут выразить злость или презрение. Просто работают другие механизмы: градация вежливости, исторические оскорбления и контекст. Разберём главные ругательства, которые ты слышишь в аниме.",
  "tags": ["Лексика", "Аниме"],
  "blocks": [
    {
      "id": "baka",
      "title": "1. バカ (baka) — король оскорблений",
      "paragraphs": [
        "Самое популярное ругательство в японском. В зависимости от контекста может значить «дурак», «идиот», «тупица» или даже «милый дурачок» (в романтическом ключе).",
        "Сила зависит от интонации. Злое «バカ！」 — реальное оскорбление. Игривое «ばーか» с улыбкой — подколка между друзьями.",
        "В «Наруто» это слово стало мемом. Саскэ постоянно называет Наруто «バカ», и по интонации всегда понятно, что он имеет в виду.",
        "Исторически слово происходит от буддийского термина, но сейчас это просто «дурак» во всех смыслах."
      ]
    },
    {
      "id": "aho",
      "title": "2. アホ (aho) — западный вариант",
      "paragraphs": [
        "В регионе Кансай (Осака, Киото) вместо «バカ» говорят «アホ». И для них это серьёзное различие.",
        "Если в Токио назвать кого-то «アホ», это прозвучит странно. А в Осаке «バカ» может быть серьёзнее, чем «アホ». Запутаться легко.",
        "В аниме персонажи из Кансая всегда используют «アホ». Это маркер их происхождения, как акцент в других языках.",
        "«アホンダラ» — усиленная версия, что-то вроде «конченый дурак». В комедийных аниме такое можно услышать."
      ]
    },
    {
      "id": "kuso",
      "title": "3. くそ (kuso) — универсальный выразитель эмоций",
      "paragraphs": [
        "Буквально значит «дерьмо», но используется как универсальное восклицание. Уронил что-то — «くそ！». Проиграл — «くそー！». Бесит всё — «くそっ».",
        "Не считается матом в нашем понимании. Это скорее как «чёрт» или «блин». Даже дети говорят.",
        "В аниме его используют все: от школьников до демонов. Разница только в интонации. Злое, резкое «くそ！» — понятно, персонаж в ярости.",
        "Производные: «くそったれ» (kuso ttare) — уже грубее, «засранец». И «くそ野郎» (kuso yarō) — «чёртов ублюдок», серьёзное оскорбление."
      ]
    },
    {
      "id": "kono-yaro",
      "title": "4. この野郎 (kono yarō) — «ты, парень...»",
      "paragraphs": [
        "«野郎» само по себе значит «парень», но в грубом, снижающем смысле. «この野郎» — обращение к тому, кого ты презираешь или с кем собираешься драться.",
        "В аниме это стандартная фраза перед битвой. «てめえ、この野郎！」 — «ты, ублюдок!». Звучит очень агрессивно.",
        "Можно комбинировать: «このバカ野郎» — «ты, чёртов идиот». Усиливает оскорбление.",
        "Вежливый японец так никогда не скажет. Но в сёнен-аниме это на каждом шагу."
      ]
    },
    {
      "id": "shine",
      "title": "5. 死ね (shine) — «сдохни»",
      "paragraphs": [
        "Самое сильное в этом списке. Буквально повелительное наклонение от глагола «умирать» — «умри».",
        "В реальной жизни так практически не говорят. Но в аниме, когда персонаж в ярости или в пылу битвы, может сорваться.",
        "Есть более мягкий вариант «死にたい» (хочу умереть), который используют в переносном смысле — когда всё плохо, но не буквально.",
        "В комедийных контекстах «死ね» может звучать как утрированная шутка. Но в серьёзных сценах это реальный показатель того, что персонаж на грани."
      ]
    }
  ],
  "test": {
    "type": "choice",
    "resultImage": "/images/test-questions/rugatelstva-anime-result.png",
    "questions": [
      {
        "question": "В каком регионе Японии вместо «バカ» чаще говорят «アホ»?",
        "choices": ["Токио", "Кансай (Осака, Киото)", "Хоккайдо", "Кюсю"],
        "correctChoiceIndex": 1,
        "image": "/images/test-questions/rugatelstva-anime-q1.png"
      },
      {
        "question": "Что ближе по смыслу к японскому «くそ！」, когда персонаж уронил что-то?",
        "choices": ["Русский мат", "«Чёрт!» или «Блин!»", "«Умри!»", "«Дурак!»"],
        "correctChoiceIndex": 1,
        "image": "/images/test-questions/rugatelstva-anime-q2.png"
      },
      {
        "question": "Фраза «てめえ、この野郎！」 в аниме чаще всего звучит:",
        "choices": ["Как вежливое обращение", "Перед битвой, как агрессивное оскорбление", "Как комплимент", "Как извинение"],
        "correctChoiceIndex": 1,
        "image": "/images/test-questions/rugatelstva-anime-q3.png"
      },
      {
        "question": "Что значит «死にたい» в переносном смысле (не буквально)?",
        "choices": ["Приказ «умри»", "«Хочу умереть» — когда всё плохо", "«Он умер»", "«Не умирай»"],
        "correctChoiceIndex": 1,
        "image": "/images/test-questions/rugatelstva-anime-q4.png"
      }
    ],
    "resultMessages": {
      "perfect": {
        "main": "やばい! Ты покорил весь сленг без единой ошибки. Настоящий мастер!",
        "sub": "Теперь ты можешь спокойно смотреть аниме, понимая эмоции своих любимых героев. めっちゃかっこいい！"
      },
      "partial": {
        "main": "Хорошо! Пару слов стоит повторить — ты уже на верном пути.",
        "sub": "Ещё немного практики — и эти слова станут твоими."
      },
      "fail": {
        "main": "Не сдавайся! Перечитай статью и попробуй ещё раз. 頑張って!",
        "sub": "Каждый раз, когда услышишь слово из статьи в аниме, оно запомнится лучше."
      }
    }
  },
  "related": [
    { "slug": "slova-intonaciya", "image": "/images/covers/slova-intonaciya.png", "tags": ["Лексика", "Интонация"], "title": "Слова, которые меняют смысл от интонации", "description": "Одно «はい» — и «да», и «чё тебе?». Разбираем слова-хамелеоны." },
    { "slug": "10-slov-anime", "image": "/images/covers/10-slov-anime-cover.png", "tags": ["Лексика", "Аниме"], "title": "10 слов, которые ты слышишь в каждом аниме", "description": "Топ слов из аниме — от «めっちゃ» до «マジで»." },
    { "slug": "chasticy-wa-i-ga", "image": "/images/covers/chasticy-wa-i-ga.png", "tags": ["Грамматика", "Манга"], "title": "Война миров: は vs が", "description": "Когда は, а когда が? Разберём на примерах из аниме." }
  ]
}
