{
  "slug": "te-forma",
  "type": "grammar",
  "title": "て-форма: главное комбо японского языка",
  "image": "/images/covers/te-forma.png",
  "cover": "/images/covers/te-forma.png",
  "backHref": "/",
  "toc": [
    { "id": "intro", "label": "Введение" },
    { "id": "obrazovanie", "label": "Как образовать て-форму" },
    { "id": "soedinenie", "label": "Соединение действий" },
    { "id": "prosba", "label": "Вежливая просьба" },
    { "id": "process", "label": "Описание процесса" },
    { "id": "razreshenie", "label": "Разрешение и запрет" },
    { "id": "test", "label": "Проверка себя" }
  ],
  "links": [{ "href": "#", "label": "Конспект" }],
  "introduction": "Если японская грамматика — это аниме, то て-форма — главный герой, который умеет всё. Соединять действия, просить о помощи, описывать процесс, спрашивать разрешение. Освой её — и ты получишь ключ к половине японской речи.",
  "tags": ["Грамматика", "Манга"],
  "blocks": [
    {
      "id": "obrazovanie",
      "title": "Как образовать て-форму",
      "paragraphs": [
        "Правила для глаголов первой группы: う、つ、る → って; む、ぶ、ぬ → んで; く → いて; ぐ → いで; す → して.",
        "Глаголы второй группы: просто замени «る» на «て». «食べる» → «食べて», «見る» → «見て».",
        "Исключения: «する» → «して», «来る» → «来て»."
      ],
      "construction": "[Глагол в て-форме]"
    },
    {
      "id": "soedinenie",
      "title": "Соединение действий",
      "paragraphs": [
        "В «Семье шпиона» Йор думает: 「買い物に行って、料理を作って、待つ」 — «Пойду в магазин, приготовлю еду и буду ждать». Время ставится только в конце. Не нужно менять каждый глагол — достаточно одного последнего.",
        "«昨日、勉強して、ゲームして、寝た» — «Вчера учился, играл и лёг спать». Прошедшее время только в «寝た».",
        "Цепочка может быть любой длины. Главное — правильный порядок: сначала то, что случилось раньше."
      ],
      "construction": "[Действие1] + て、[Действие2] + て、[Действие3]"
    },
    {
      "id": "prosba",
      "title": "Вежливая просьба",
      "paragraphs": [
        "«ちょっと待ってください» — «Подождите минутку, пожалуйста». Классика любой дорамы. «写真を撮ってください» — «Сфотографируйте, пожалуйста». Идеально для путешествий.",
        "«教えてください» — «Научите меня / скажите мне». Вежливая просьба об информации.",
        "Без «ください» просьба звучит грубо, как приказ. «待って» — просто «жди», так можно только близким друзьям."
      ],
      "construction": "[Глагол в て-форме] + ください"
    },
    {
      "id": "process",
      "title": "Описание процесса",
      "paragraphs": [
        "«今、アニメを見ている» — «Сейчас смотрю аниме». Действие происходит прямо сейчас. «彼は毎日勉強している» — «Он каждый день учится». Постоянное действие, привычка.",
        "«結婚している» — «женат / замужем». Состояние-результат: поженились в прошлом и теперь в этом состоянии.",
        "«知っている» — «знаю». Тоже состояние: узнал когда-то и теперь знаешь."
      ],
      "construction": "[Глагол в て-форме] + いる"
    },
    {
      "id": "razreshenie",
      "title": "Разрешение и запрет",
      "paragraphs": [
        "«トイレに行ってもいいですか?» — «Можно выйти?». Школьная классика. «ここに座ってもいい?» — «Можно сесть здесь?». Неформальный вариант для друзей.",
        "«ここで写真を撮ってはいけません» — «Здесь нельзя фотографировать». Строгий запрет.",
        "«食べてはいけない» — «Нельзя есть». Запрет на действие."
      ],
      "construction": "[Глагол в て-форме] + もいいですか？ / てはいけません"
    }
  ],
  "test": {
    "type": "grammar",
    "instruction": "Соберите предложение",
    "resultImage": "/images/test-questions/te-forma-result.png",
    "questions": [
      {
        "sentence": "Подождите, пожалуйста.",
        "correctWords": ["待って", "ください"],
        "distractors": ["見て", "行って", "食べて"],
        "image": "/images/test-questions/te-forma-q1.png"
      },
      {
        "sentence": "Смотрю (действие сейчас).",
        "correctWords": ["見て", "いる"],
        "distractors": ["食べて", "ください", "行って"],
        "image": "/images/test-questions/te-forma-q2.png"
      },
      {
        "sentence": "Можно выйти?",
        "correctWords": ["行って", "も", "いい", "ですか"],
        "distractors": ["待って", "は", "いけません", "見て"],
        "image": "/images/test-questions/te-forma-q3.png"
      },
      {
        "sentence": "Учился и лёг спать.",
        "correctWords": ["勉強して", "寝た"],
        "distractors": ["見て", "いる", "ください", "行って"],
        "image": "/images/test-questions/te-forma-q4.png"
      }
    ],
    "resultMessages": {
      "perfect": {
        "main": "やばい! Все предложения с て-формой собраны верно. Теперь можешь соединять действия и вежливо просить!",
        "sub": "С て-формой ты сможешь просить 待ってください, говорить 見ている и связывать действия. Ключ к половине японской речи — твой!"
      },
      "partial": {
        "main": "Хорошо! Пару конструкций с て стоит повторить — ты уже на верном пути.",
        "sub": "Ещё немного практики — и て-форма станет твоим главным комбо."
      },
      "fail": {
        "main": "Не сдавайся! Перечитай статью и попробуй ещё раз. 頑張って!",
        "sub": "Каждый пример из статьи приближает к чувству て-формы: просьба, процесс, цепочка действий."
      }
    }
  },
  "related": [
    { "slug": "chasticy-wa-i-ga", "image": "/images/covers/chasticy-wa-i-ga.png", "tags": ["Грамматика", "Манга"], "title": "Война миров: は vs が", "description": "Кто главный в предложении? Разбираем на примерах из аниме." },
    { "slug": "rugatelstva-anime", "image": "/images/covers/rugatelstva-anime.png", "tags": ["Лексика", "Аниме"], "title": "Как ругаются в японских аниме", "description": "バカ, くそ, この野郎." },
    { "slug": "10-slov-anime", "image": "/images/covers/10-slov-anime-cover.png", "tags": ["Лексика", "Аниме"], "title": "10 слов из каждого аниме", "description": "От «めっちゃ» до «マジで»." }
  ]
}
