{
  "slug": "chasticy-wa-i-ga",
  "type": "grammar",
  "title": "Война миров: は vs が — кто главный в предложении?",
  "image": "/images/covers/chasticy-wa-i-ga.png",
  "cover": "/images/covers/chasticy-wa-i-ga.png",
  "backHref": "/",
  "toc": [
    { "id": "intro", "label": "Введение" },
    { "id": "wa-marker", "label": "は — маркер темы" },
    { "id": "ga-marker", "label": "が — маркер субъекта" },
    { "id": "contrast", "label": "Контраст с は и акцент с が" },
    { "id": "scenes", "label": "Сцены из аниме" },
    { "id": "lifehack", "label": "Лайфхак для запоминания" },
    { "id": "test", "label": "Проверка себя" }
  ],
  "links": [{ "href": "#", "label": "Конспект" }],
  "introduction": "Самый частый вопрос всех изучающих японский. Когда использовать は, а когда が? Учебники пишут сложные объяснения, но мы разберёмся на примерах из аниме. После этой статьи ты перестанешь путать их раз и навсегда.",
  "tags": ["Грамматика", "Манга"],
  "blocks": [
    {
      "id": "wa-marker",
      "title": "は — маркер темы",
      "paragraphs": [
        "「は」 указывает на тему разговора — то, о ЧЁМ мы сейчас говорим. Представь, что ты включаешь прожектор и направляешь его на объект.",
        "В «Клинке, рассекающем демонов» Тандзиро говорит: 「俺は優しい」 — «Я (что касается меня) — добрый». Он не сравнивает себя с другими, а просто заявляет качество.",
        "Тема уже известна собеседнику или вводится впервые. 「これは本です」 — «Это (что касается этого предмета) — книга». Главное правило: は вводит контекст, а всё, что после — информация об этом контексте."
      ],
      "construction": "[Тема] + は + [комментарий]"
    },
    {
      "id": "ga-marker",
      "title": "が — маркер субъекта",
      "paragraphs": [
        "「が」 указывает на субъект действия — того, КТО совершает действие. Прожектор выхватывает именно исполнителя.",
        "В «Наруто» Саскэ говорит: 「俺が復讐する」 — «ИМЕННО Я отомщу». Акцент на том, кто будет мстить.",
        "Если в предложении есть вопрос «кто?» или «что?», ответ будет с が. 「誰が来た?」 — «Кто пришёл?」 → 「友達が来た」 — «Пришёл друг». が также используется с глаголами существования: 「いる」 и 「ある」. 「猫がいる」 — «(вот) кошка есть»."
      ],
      "construction": "[Субъект] + が + [действие/состояние]"
    },
    {
      "id": "contrast",
      "title": "Контраст с は и акцент с が",
      "paragraphs": [
        "「は」 часто работает как контрастный маркер. 「日本語はできるが、英語はできない」 — «Японский знаю, а английский — нет».",
        "В «Твоём имени» есть диалог: 「ミツハは元気?」 — «Как там Мицуха?». Говорящего интересует именно она, а не кто-то другой.",
        "「が」 даёт акцент на новом или неизвестном. 「昔々、おじいさんがいました」 — «Жил-был старик». Мы впервые о нём слышим, поэтому が. В следующих предложениях о нём уже будут использовать は, потому что тема известна."
      ],
      "construction": "[Тема1] + は + [информация] が、[Тема2] + は + [информация]"
    },
    {
      "id": "scenes",
      "title": "Сцены из аниме",
      "paragraphs": [
        "В «Клинке…» Тандзиро говорит про сестру: 「禰豆子は人間だった」 — «Нэдзуко была человеком». Тема — Нэдзуко, комментарий — что она была человеком. Но когда он зовёт её: 「禰豆子が!」 — «(Вот же) Нэдзуко!». Он её увидел, субъект появился в поле зрения — используется が.",
        "В «Наруто» диалог: 「お前はバカだ」 — «Ты дурак» (тема — ты, характеристика — дурак). 「俺が火影になる!」 — «ИМЕННО Я стану Хокаге!» (акцент на себе).",
        "「は」 для общих утверждений, 「が」 для конкретных, акцентных."
      ],
      "construction": null
    },
    {
      "id": "lifehack",
      "title": "Лайфхак для запоминания",
      "paragraphs": [
        "Попробуй мысленно подставлять эти фразы. 「私は学生」 — «Что касается меня, я студент». 「私が学生」 — «ИМЕННО я студент» (а не кто-то другой).",
        "В вопросах с вопросительными словами всегда が. 「誰が?」 — «кто именно?». 「何が?» — «что именно?». В ответах на них тоже が. 「田中さんが来た」 — «Пришёл ИМЕННО Танака».",
        "Когда вводишь новый предмет в историю — が. Потом говоришь о нём — は. Это правило покрывает 80% случаев."
      ],
      "construction": "は = «что касается…», が = «именно…»"
    }
  ],
  "test": {
    "type": "grammar",
    "instruction": "Соберите предложение",
    "resultImage": "/images/test-questions/wa-ga-result.png",
    "questions": [
      {
        "sentence": "Я — студент. (тема: речь обо мне)",
        "correctWords": ["私", "は", "学生", "です"],
        "distractors": ["彼", "が", "先生", "猫"],
        "image": "/images/test-questions/wa-ga-q1.png"
      },
      {
        "sentence": "Кто пришёл? — Пришёл Танака. (акцент на том, кто именно)",
        "correctWords": ["田中", "さん", "が", "来た"],
        "distractors": ["は", "私", "行った", "です"],
        "image": "/images/test-questions/wa-ga-q2.png"
      },
      {
        "sentence": "Именно я стану Хокаге! (Наруто)",
        "correctWords": ["俺", "が", "火影", "に", "なる"],
        "distractors": ["は", "お前", "を", "だ"],
        "image": "/images/test-questions/wa-ga-q3.png"
      },
      {
        "sentence": "Японский знаю, а английский — нет. (контраст)",
        "correctWords": ["日本語", "は", "できる", "が", "英語", "は", "できない"],
        "distractors": ["が", "私", "です", "を"],
        "image": "/images/test-questions/wa-ga-q4.png"
      }
    ],
    "resultMessages": {
      "perfect": {
        "main": "やばい! Все предложения собраны верно. は и が больше не путаются!",
        "sub": "Теперь в аниме будешь слышать, кто тема, а кто в фокусе. は и が — твои."
      },
      "partial": {
        "main": "Хорошо! Пару конструкций стоит повторить — ты уже на верном пути.",
        "sub": "Ещё немного практики — и частицы станут твоими."
      },
      "fail": {
        "main": "Не сдавайся! Перечитай статью и попробуй ещё раз. 頑張って!",
        "sub": "Каждый пример из статьи приближает к чувству は и が."
      }
    }
  },
  "related": [
    { "slug": "rugatelstva-anime", "image": "/images/covers/rugatelstva-anime.png", "tags": ["Лексика", "Аниме"], "title": "Как ругаются в японских аниме", "description": "バカ, くそ, この野郎 — разбираем ругательства из аниме." },
    { "slug": "te-forma", "image": "/images/covers/te-forma.png", "tags": ["Грамматика", "Манга"], "title": "て-форма: главное комбо японского языка", "description": "Соединять действия, просить, описывать процесс." },
    { "slug": "jujutsu-first-page", "image": "/images/covers/jujutsu-first-page.png", "tags": ["Чтение", "Манга"], "title": "Первая страница манги «Магическая битва»", "description": "Первый разворот культовой манги — читай в оригинале." }
  ]
}
