{
  "slug": "tiktok-twitter-sleneg",
  "type": "lexicon",
  "title": "Японский сленг из TikTok и Twitter",
  "image": "/images/covers/tiktok-twitter-sleneg.png",
  "cover": "/images/covers/tiktok-twitter-sleneg.png",
  "backHref": "/",
  "toc": [
    { "id": "intro", "label": "Введение" },
    { "id": "w", "label": "1. り (w) — смех по-японски" },
    { "id": "pien", "label": "2. ぴえん (pien) — грустная мордочка" },
    { "id": "sore-na", "label": "3. それな (sore na) — «и не говори»" },
    { "id": "egui", "label": "4. えぐい (egui) — «жёстко»" },
    { "id": "bazuru", "label": "5. バズる (bazuru) — стать вирусным" },
    { "id": "test", "label": "Проверка себя" }
  ],
  "links": [{ "href": "#", "label": "Список слов из статьи" }],
  "introduction": "Ты выучил японский по учебникам, заходишь в твиттер японского друга и ничего не понимаешь. Потому что там сплошные сокращения, странные буквы и смайлики. Интернет-сленг в Японии развивается быстрее, чем где-либо. Держи подборку того, без чего ты не поймёшь современного японца в сети.",
  "tags": ["Лексика", "Сленг"],
  "blocks": [
    {
      "id": "w",
      "title": "1. り (w) — смех по-японски",
      "paragraphs": [
        "В русском интернете пишут «лол» или просто смеются. В японском всё сложнее и проще одновременно. «笑» (warai — смех) сократили до одной буквы «w».",
        "Чем больше «w», тем смешнее. «wwww» — это уже аналог нашего «ахахахах». Иногда пишут целыми строчками: «wwwwwwww».",
        "Есть даже ироничное «草» (kusa — трава), потому что много «w» подряд напоминает растущую траву. Увидел «草生えた» — значит «меня прорвало на смех».",
        "В твиттере и тиктоке это используют постоянно. Без «w» ты не поймёшь, смешно человеку или нет."
      ]
    },
    {
      "id": "pien",
      "title": "2. ぴえん (pien) — грустная мордочка",
      "paragraphs": [
        "Звукоподражание всхлипыванию, которое стало мемом и полноценным словом. Означает лёгкую грусть, разочарование или просто милую жалобу.",
        "Девушки пишут «ぴえん» когда что-то пошло не так: «今日彼氏に会えない…ぴえん» — «Сегодня не встречусь с парнем… грустняшка».",
        "Есть усиленная версия «ぴえん超えてパーン» (pien koete pān) — «грустняшка за гранью», когда случилось что-то реально печальное.",
        "В 2020-м это слово даже признали одним из главных молодёжных выражений. Так что если увидишь в комментариях — знай, человеку грустно, но скорее по-милому."
      ]
    },
    {
      "id": "sore-na",
      "title": "3. それな (sore na) — «и не говори»",
      "paragraphs": [
        "Короткий и очень популярный способ согласиться с собеседником. Буквально «это именно так». Аналог нашего «вот это да» или «ну да».",
        "Кто-то пишет в твиттере: «今日暑すぎ» (сегодня слишком жарко). Ответ в комментариях: «それな» — «это точно».",
        "Можно усилить: «それなそれな» — двойное согласие. Или добавить эмоций: «それなwwww».",
        "В аниме тоже часто используют, особенно в школьных сценах, когда персонажи обсуждают что-то житейское."
      ]
    },
    {
      "id": "egui",
      "title": "4. えぐい (egui) — «жёстко»",
      "paragraphs": [
        "Изначально слово означало «жестокий», «суровый». Но молодёжь переосмыслила его в сторону «круто, но с оттенком безумия».",
        "Увидел безумный клип в тиктоке — «えぐい». Попробовал острую еду — «えぐい». Друг сделал что-то невероятное — тоже «えぐい».",
        "Очень эмоциональное слово, которое показывает, что ты впечатлён до глубины души, но не знаешь, как это выразить нормально.",
        "Часто пишут просто «えぐ», отбрасывая последний слог. Ещё более сокращённый вариант для своих."
      ]
    },
    {
      "id": "bazuru",
      "title": "5. バズる (bazuru) — стать вирусным",
      "paragraphs": [
        "Адаптация английского «buzz» под японскую грамматику. Означает, что пост или видео набрало кучу просмотров и лайков.",
        "«この動画バズってる» — «это видео завирусилось». Используется постоянно в твиттере и тиктоке.",
        "Есть производные: «バズりたい» (хочу стать вирусным), «バズった» (стало вирусным в прошлом).",
        "Блогеры помешаны на этом слове. Если хочешь обсуждать тренды с японцами, без «バズる» не обойтись."
      ]
    }
  ],
  "test": {
    "type": "choice",
    "questions": [
      {
        "question": "Что значит «草生えた» в японском интернет-сленге?",
        "image": "/images/test-questions/tiktok-twitter-q1.png",
        "choices": ["Выросла трава", "Меня прорвало на смех", "Мне грустно", "Видео стало вирусным"],
        "correctChoiceIndex": 1
      },
      {
        "question": "Когда японка пишет «今日彼氏に会えない…ぴえん», что она имеет в виду?",
        "image": "/images/test-questions/tiktok-twitter-q2.png",
        "choices": ["Радуется встрече", "Грустит, что не встретится с парнем", "Смеётся над шуткой", "Хочет стать вирусной"],
        "correctChoiceIndex": 1
      },
      {
        "question": "Кто-то ответил на твит «今日暑すぎ» словом «それな». Что он хочет сказать?",
        "image": "/images/test-questions/tiktok-twitter-q3.png",
        "choices": ["Не согласен", "Полностью согласен — это точно", "Предлагает встретиться", "Спрашивает про погоду"],
        "correctChoiceIndex": 1
      },
      {
        "question": "Что означает «この動画バズってる»?",
        "image": "/images/test-questions/tiktok-twitter-q4.png",
        "choices": ["Это видео сняли плохо", "Это видео завирусилось", "Это видео про пчёл", "Это видео удалили"],
        "correctChoiceIndex": 1
      }
    ]
  },
  "related": [
    { "slug": "10-slov-anime", "image": "/images/covers/10-slov-anime-cover.png", "tags": ["Лексика", "Аниме"], "title": "10 слов, которые ты слышишь в каждом аниме", "description": "Топ слов из аниме — от «めっちゃ» до «マジで»." },
    { "slug": "rugatelstva-anime", "image": "/images/covers/rugatelstva-anime.png", "tags": ["Лексика", "Аниме"], "title": "Как ругаются в японских аниме", "description": "バカ, くそ, この野郎 — разбираем ругательства из аниме." },
    { "slug": "slova-intonaciya", "image": "/images/covers/slova-intonaciya.png", "tags": ["Лексика", "Интонация"], "title": "Слова, которые меняют смысл от интонации", "description": "Одно «はい» — и «да», и «чё тебе?». Слова-хамелеоны." }
  ]
}
