{
  "slug": "10-slov-anime",
  "type": "lexicon",
  "title": "10 слов, которые ты слышишь в каждом аниме, но не знаешь, что они значат",
  "image": "/images/covers/10-slov-anime-cover.png",
  "cover": "/images/covers/10-slov-anime-cover.png",
  "backHref": "/",
  "toc": [
    { "id": "intro", "label": "Введение" },
    { "id": "meccha", "label": "1. めっちゃ (meccha) — «офигеть как»" },
    { "id": "uzai", "label": "2. うざい (uzai) — «бесит»" },
    { "id": "mukatsuku", "label": "3. むかつく (mukatsuku) — «аж бесит»" },
    { "id": "yabai", "label": "4. やばい (yabai) — «офигеть»" },
    { "id": "majide", "label": "5. マジで？ (maji de?) — «серьёзно?»" },
    { "id": "test", "label": "Проверка себя" }
  ],
  "links": [{ "href": "#", "label": "Список слов из статьи" }],
  "introduction": "Ты смотришь аниме, и вдруг слышишь слово, которое повторяется в каждой второй серии. Интуитивно ты понимаешь, что оно что-то значит, но переводчик выдаёт что-то странное. Знакомо? Мы собрали топ самых частых слов, которые реально используют персонажи — от школьников до демонов. Запоминай, они будут встречаться тебе постоянно.",
  "tags": ["Лексика", "Аниме"],
  "blocks": [
    {
      "id": "meccha",
      "title": "1. めっちゃ (meccha) — «офигеть как»",
      "paragraphs": [
        "Это слово — король неформального усиления. Вместо скучного «очень» японцы вставляют «めっちゃ» везде, где хотят подчеркнуть эмоцию.",
        "Если ты хочешь сказать, что аниме было крутым, можно сказать «面白かった» (интересно), а можно «めっちゃ面白かった» — и сразу слышен уровень восторга. Разница колоссальная.",
        "В Кансайском регионе вместо «めっちゃ» говорят «めちゃくちゃ» или просто «めちゃ». Это тоже часто встречается в аниме, где персонажи оттуда.",
        "Главное правило: ставь перед прилагательным или глаголом, и слово сразу становится эмоциональнее. «疲れた» (я устал) → «めっちゃ疲れた» (я просто вымотан)."
      ]
    },
    {
      "id": "uzai",
      "title": "2. うざい (uzai) — «бесит»",
      "paragraphs": [
        "Короткое и ёмкое слово для выражения раздражения. Может относиться к человеку, ситуации, звуку — ко всему, что действует на нервы.",
        "В аниме его чаще всего используют цундэрэ-персонажи, когда не хотят показывать свои настоящие чувства. «うざいんだよ!» — «Отстань, бесишь!» — классика жанра.",
        "Есть более вежливая форма «うるさい» (громко, шумно), но «うざい» грубее и эмоциональнее. Если услышишь, знай — персонаж реально разозлился.",
        "Интересно, что слово может применяться даже к погоде или обстоятельствам: «この雨、うざい» — «Этот дождь бесит»."
      ]
    },
    {
      "id": "mukatsuku",
      "title": "3. むかつく (mukatsuku) — «аж бесит»",
      "paragraphs": [
        "Ещё одно слово для выражения негатива, но гораздо более сильное. Если «うざい» — это скорее раздражение, то «むかつく» — это уже злость, часто с оттенком «меня тошнит от этого».",
        "В сёнен-аниме его говорят перед дракой, когда персонаж реально взбешён действиями врага. «むかつく奴だ» — «Ну и тип, бесит просто».",
        "Может использоваться и буквально — про тошноту после еды. Но в 90% случаев в аниме это именно эмоциональное состояние.",
        "Есть ещё более грубый вариант «むかつくんだよ», который добавляет акцент на личное отношение."
      ]
    },
    {
      "id": "yabai",
      "title": "4. やばい (yabai) — «офигеть» (во всех смыслах)",
      "paragraphs": [
        "Самое универсальное слово японского языка. Может значить и «опасно», и «круто», и «всё пропало», и «нифига себе» — в зависимости от контекста и интонации.",
        "Если персонаж увидел монстра и кричит «やばい！», значит «опасно, бежим!». Если попробовал рамен и выдыхает «やばい…», значит «это просто божественно вкусно».",
        "Молодёжь использует его постоянно. «それやばくない?» — «Это жесть, правда?» — стандартная реакция на всё необычное.",
        "Ключ к пониманию — интонация и ситуация. Если персонаж улыбается и тянет гласные — это восхищение. Если глаза выпучены и голос напряжён — реальная опасность."
      ]
    },
    {
      "id": "majide",
      "title": "5. マジで？ (maji de?) — «серьёзно?»",
      "paragraphs": [
        "Незаменимая фраза для выражения удивления, недоверия или шока. «マジ» произошло от «真面目» (серьёзный), поэтому буквально это «серьёзно?».",
        "В аниме её говорят абсолютно все: от школьниц до суровых воинов. Услышал неожиданную новость — «マジで？». Увидел, что враг сильнее, чем думал — «マジで…».",
        "Можно использовать и как утверждение: «マジで行くよ» — «Я серьёзно пойду». Или как вопрос: «マジ？» — сокращённый вариант для близких друзей.",
        "Если хочешь звучать как носитель, запомни интонацию: на «ма» голос идёт вверх, на «дзи» — вниз. «МаДЗИдэ?» — и тебя поймут правильно."
      ]
    }
  ],
  "test": {
    "type": "choice",
    "questions": [
      {
        "question": "Персонаж говорит: «めっちゃ疲れた». Что он имеет в виду?",
        "image": "/images/test-questions/10-slov-q1.png",
        "choices": ["Я очень устал", "Я очень голоден", "Мне очень весело", "Мне очень грустно"],
        "correctChoiceIndex": 0
      },
      {
        "question": "Цундэрэ кричит: «うざいんだよ!». Как лучше перевести?",
        "image": "/images/test-questions/10-slov-q2.png",
        "choices": ["Отстань, бесишь!", "Как интересно!", "Очень вкусно!", "Серьёзно?"],
        "correctChoiceIndex": 0
      },
      {
        "question": "Персонаж попробовал рамен и выдохнул: «やばい…». Что он скорее всего имеет в виду?",
        "image": "/images/test-questions/10-slov-q3.png",
        "choices": ["Опасность, надо бежать", "Это невероятно вкусно", "Мне грустно", "Я не понимаю"],
        "correctChoiceIndex": 1
      },
      {
        "question": "От какого слова произошло «マジ» во фразе «マジで？」?",
        "image": "/images/test-questions/10-slov-q4.png",
        "choices": ["真面目 (мадзимэ — серьёзный)", "魔法 (махо — магия)", "町 (мати — город)", "窓 (мадо — окно)"],
        "correctChoiceIndex": 0
      }
    ]
  },
  "related": [
    { "slug": "tiktok-twitter-sleneg", "image": "/images/covers/tiktok-twitter-sleneg.png", "tags": ["Лексика", "Сленг"], "title": "Японский сленг из TikTok и Twitter", "description": "Сокращения и смайлики — без этого не поймёшь японца в сети." },
    { "slug": "rugatelstva-anime", "image": "/images/covers/rugatelstva-anime.png", "tags": ["Лексика", "Аниме"], "title": "Как ругаются в японских аниме", "description": "バカ, くそ, この野郎 — разбираем ругательства из аниме." },
    { "slug": "slova-intonaciya", "image": "/images/covers/slova-intonaciya.png", "tags": ["Лексика", "Интонация"], "title": "Слова, которые меняют смысл от интонации", "description": "Одно «はい» — и «да», и «чё тебе?». Разбираем слова-хамелеоны." }
  ]
}
