{
  "slug": "slova-intonaciya",
  "type": "lexicon",
  "title": "Слова, которые меняют смысл в зависимости от интонации",
  "image": "/images/covers/slova-intonaciya.png",
  "cover": "/images/covers/slova-intonaciya.png",
  "backHref": "/",
  "toc": [
    { "id": "intro", "label": "Введение" },
    { "id": "hai", "label": "1. はい (hai) — от «да» до «чё те надо?»" },
    { "id": "so", "label": "2. そう (sō) — от «ага» до «да ладно?!»" },
    { "id": "ee", "label": "3. ええ (ē) — от вежливого согласия до испанского стыда" },
    { "id": "un", "label": "4. うん (un) — неформальное согласие" },
    { "id": "hee", "label": "5. へえ (hē) — удивление с оттенком скепсиса" },
    { "id": "test", "label": "Проверка себя" }
  ],
  "links": [{ "href": "#", "label": "Список слов из статьи" }],
  "introduction": "В японском есть слова, которые звучат одинаково, но значат совершенно разное в зависимости от того, как их сказать. Одно и то же «はい» может быть и вежливым «да», и раздражённым «что тебе?», и удивлённым «что?!!». Сейчас разберём эти слова-хамелеоны.",
  "tags": ["Лексика", "Интонация"],
  "blocks": [
    {
      "id": "hai",
      "title": "1. はい (hai) — от «да» до «чё те надо?»",
      "paragraphs": [
        "Самый частый пример. В учебниках пишут, что это просто «да». В реальности всё сложнее. Спокойное, ровное «はい» — это подтверждение. «はい、そうです» — «да, это так».",
        "Короткое, резкое «はい？」 с вопросительной интонацией — аналог нашего «чё?» или «в смысле?». Так отвечают, когда не расслышали или когда собеседник сказал что-то странное.",
        "Тягучее «はーい» с улыбкой — весёлое согласие сделать что-то. «はーい、行きます!» — «да-да, иду!».",
        "А если «はい» повторяют дважды с нажимом — «はいはい» — это уже сарказм, типа «да-да, конечно, как скажешь». В аниме цундэрэ так часто отвечают."
      ]
    },
    {
      "id": "so",
      "title": "2. そう (sō) — от «ага» до «да ладно?!»",
      "paragraphs": [
        "«そう» — универсальная реакция на что угодно. Нейтральное «そうですか» — «вот как». «そうだね» — «да, согласен».",
        "Но если сказать «そう？» с удивлением — это «правда?» или «ты серьёзно?». Интонация идёт вверх, и слово меняет смысл.",
        "Протяжное «そーう…» — задумчивое, когда человек обдумывает услышанное. А короткое «そう！」 — внезапное осознание, как наше «а, точно!».",
        "В аниме это слово слышно постоянно. По интонации всегда понятно, персонаж соглашается, удивляется или просто тянет время."
      ]
    },
    {
      "id": "ee",
      "title": "3. ええ (ē) — от вежливого согласия до испанского стыда",
      "paragraphs": [
        "Спокойное «ええ» — это чуть более вежливый аналог «はい». Так ответит взрослый человек или в формальной ситуации.",
        "Но «ええ…» с тягучей интонацией и опущенными глазами — это уже неловкость, сомнение или лёгкий испанский стыд. «ええ、それはちょっと…» — «эм, это немного…».",
        "В комедийных аниме так реагируют на неловкие шутки. Персонаж не знает, что сказать, и просто тянет «ええ…», ожидая, пока ситуация разрешится.",
        "Резкое «ええ！」 с восклицанием — удивление. «ええ！まじで！」 — «чё, серьёзно?!»."
      ]
    },
    {
      "id": "un",
      "title": "4. うん (un) — неформальное согласие",
      "paragraphs": [
        "Всё, что мы говорили про «はい», работает и для «うん», но в неформальном ключе. Кивок и «うん» — «ага, понял».",
        "Растянутое «うーん…» — размышление. «うーん、どうしようかな» — «хм, что же делать». В аниме так часто тянут, когда персонаж в сомнениях.",
        "Короткое «うん？」 с вопросительной интонацией — «а? что?» Так реагируют, когда отвлеклись или не расслышали.",
        "А «うんうん» с кивками — подбадривание, когда слушаешь чей-то рассказ и показываешь, что внимаешь. «うんうん、それで？» — «ага-ага, и что дальше?»."
      ]
    },
    {
      "id": "hee",
      "title": "5. へえ (hē) — удивление с оттенком скепсиса",
      "paragraphs": [
        "«へえ» — классическое удивление. «へえ、そうなんだ» — «ого, вот как». Но в этой интонации часто слышен лёгкий скепсис, особенно если растянуть.",
        "«へえ…» с паузой означает, что персонаж удивлён, но не до конца верит. «へえ、よく知ってるね» — «ого, ну ты и знаток» — может быть и комплиментом, и сарказмом.",
        "Короткое «へっ？」 — удивление с оттенком «чё за хрень?». Так реагируют на абсурдные новости или неожиданные повороты.",
        "Если услышишь повторяющееся «へえへえへえ» — персонаж либо очень удивлён, либо издевается. В комедийных сценах это работает безотказно."
      ]
    }
  ],
  "test": {
    "type": "choice",
    "questions": [
      {
        "question": "Что обычно значит «はいはい» с нажимом в разговоре?",
        "image": "/images/test-questions/slova-intonaciya-q1.png",
        "choices": ["Искреннее согласие", "Сарказм: «да-да, как скажешь»", "Вопрос «что?»", "Радостное «иду!»"],
        "correctChoiceIndex": 1
      },
      {
        "question": "«そう？」 с интонацией вверх — это скорее:",
        "image": "/images/test-questions/slova-intonaciya-q2.png",
        "choices": ["«Вот как»", "«Правда? Ты серьёзно?»", "«А, точно!»", "«Да, согласен»"],
        "correctChoiceIndex": 1
      },
      {
        "question": "Когда персонаж тянет «ええ…» с паузой, он чаще всего выражает:",
        "image": "/images/test-questions/slova-intonaciya-q3.png",
        "choices": ["Вежливое «да»", "Неловкость или испанский стыд", "Восторг", "Злость"],
        "correctChoiceIndex": 1
      },
      {
        "question": "«うんうん、それで？」 в диалоге обычно значит:",
        "image": "/images/test-questions/slova-intonaciya-q4.png",
        "choices": ["«Нет, не согласен»", "«Ага-ага, и что дальше?» — подбадривание рассказчика", "«А? Что?» — не расслышал", "«Хм, подумаю»"],
        "correctChoiceIndex": 1
      }
    ],
    "resultImage": "/images/test-questions/slova-intonaciya-result.png"
  },
  "related": [
    { "slug": "10-slov-anime", "image": "/images/covers/10-slov-anime-cover.png", "tags": ["Лексика", "Аниме"], "title": "10 слов, которые ты слышишь в каждом аниме", "description": "Топ слов из аниме — от «めっちゃ» до «マジで»." },
    { "slug": "tiktok-twitter-sleneg", "image": "/images/covers/tiktok-twitter-sleneg.png", "tags": ["Лексика", "Сленг"], "title": "Японский сленг из TikTok и Twitter", "description": "Сокращения и смайлики — без этого не поймёшь японца в сети." },
    { "slug": "chasticy-wa-i-ga", "image": "/images/covers/chasticy-wa-i-ga.png", "tags": ["Грамматика", "Манга"], "title": "Война миров: は vs が", "description": "Когда は, а когда が? Разберём на примерах из аниме." }
  ]
}
