{
  "slug": "sugiru",
  "type": "grammar",
  "title": "〜すぎる: когда всего слишком много",
  "image": "/images/covers/sugiru.png",
  "cover": "/images/covers/sugiru.png",
  "backHref": "/",
  "toc": [
    { "id": "intro", "label": "Введение" },
    { "id": "glagol", "label": "С глаголами — слишком много действия" },
    { "id": "prilag", "label": "С прилагательными — слишком много качества" },
    { "id": "znachenie", "label": "В значении «чрезмерно»" },
    { "id": "byt", "label": "В бытовых ситуациях" },
    { "id": "isklyucheniya", "label": "Исключения и нюансы" },
    { "id": "test", "label": "Проверка себя" }
  ],
  "links": [{ "href": "#", "label": "Конспект" }],
  "introduction": "Этот мир полон крайностей. Аниме слишком длинное. Еда слишком острая. Люди слишком громкие. Для всего этого в японском есть гениальная конструкция «〜すぎる». Освой её, и сможешь жаловаться как настоящий японец.",
  "tags": ["Грамматика", "Манга"],
  "blocks": [
    {
      "id": "glagol",
      "title": "С глаголами — слишком много действия",
      "paragraphs": [
        "«食べすぎた» — «переел» (слишком много съел). Классика после новогодних праздников. «飲みすぎた» — «перепил». Утро после вечеринки. «働きすぎだ» — «слишком много работаю». Вечная жалоба офисных работников.",
        "В аниме часто говорят: 「考えすぎだよ」 — «Ты слишком много думаешь». Успокаивают рефлексирующего героя.",
        "Основа глагола: у る-глаголов убираем る (食べる → 食べ), у う-глаголов меняем последний слог (飲む → 飲み, 働く → 働き)."
      ],
      "construction": "[Основа глагола] + すぎる"
    },
    {
      "id": "prilag",
      "title": "С прилагательными — слишком много качества",
      "paragraphs": [
        "Для прилагательных на «い»: убираем «い» и добавляем «すぎる». «暑い» → «暑すぎる» — «слишком жарко». Для прилагательных на «な»: просто добавляем «すぎる». «静か» → «静かすぎる» — «слишком тихо».",
        "«このラーメン、辛すぎる» — «Эта лапша слишком острая». Не можешь есть, но вкусно. «彼の説明は長すぎる» — «Его объяснения слишком длинные». Типичная реакция на зануду.",
        "Прилагательное в прошедшем или вежливом виде: «暑すぎた», «辛すぎます»."
      ],
      "construction": "[Основа прилагательного] + すぎる"
    },
    {
      "id": "znachenie",
      "title": "В значении «чрезмерно»",
      "paragraphs": [
        "«簡単すぎてつまらない» — «Так просто, что скучно». Слишком легко = неинтересно. «高すぎて買えない» — «Так дорого, что не купить». Вечная проблема. «可愛すぎて死にそう» — «Такая милая, что аж умереть». Преувеличение фанатов.",
        "В аниме-комментариях это встречается постоянно. 「神回すぎる」 — «Слишком божественная серия», то есть просто охренеть какая крутая.",
        "После すぎて идёт следствие: причина в избытке, результат — что из-за этого происходит."
      ],
      "construction": "[Слово] + すぎる + [результат]"
    },
    {
      "id": "byt",
      "title": "В бытовых ситуациях",
      "paragraphs": [
        "«飲みすぎて頭が痛い» — «Перепил, голова болит». Последствия вечеринки. «遊びすぎて宿題が終わらない» — «Слишком много гулял, домашку не сделал». Детская драма. «寝すぎて遅刻した» — «Переспал, опоздал». Утренняя паника.",
        "«気にしすぎだよ» — «Ты слишком переживаешь». Утешение для тревожных.",
        "Форма すぎて связывает избыточное действие с его результатом в одном предложении."
      ],
      "construction": "[Причина] + すぎる + [следствие]"
    },
    {
      "id": "isklyucheniya",
      "title": "Исключения и нюансы",
      "paragraphs": [
        "«いい» (хороший) → «よすぎる» (слишком хороший). Не «いすぎる», а именно «よすぎる» — исключение. «ない» (нет) → «なさすぎる» (слишком мало/нет). «時間なさすぎ» — «времени слишком мало».",
        "В разговоре часто отбрасывают «る». «暑すぎ» вместо «暑すぎる». Коротко и эмоционально.",
        "«やばすぎ» — универсальная реакция на всё чрезмерное. Круто, страшно, смешно — всё в одном."
      ],
      "construction": "[Основа прилагательного] + すぎる (исключения)"
    }
  ],
  "test": {
    "type": "grammar",
    "instruction": "Соберите предложение",
    "resultImage": "/images/test-questions/sugiru-result.png",
    "questions": [
      {
        "sentence": "Переел.",
        "correctWords": ["食べ", "すぎた"],
        "distractors": ["飲み", "暑", "辛"],
        "image": "/images/test-questions/sugiru-q1.png"
      },
      {
        "sentence": "Слишком жарко.",
        "correctWords": ["暑", "すぎる"],
        "distractors": ["食べ", "静か", "長"],
        "image": "/images/test-questions/sugiru-q2.png"
      },
      {
        "sentence": "Так дорого, что не купить.",
        "correctWords": ["高", "すぎて", "買えない"],
        "distractors": ["簡単", "辛", "飲み"],
        "image": "/images/test-questions/sugiru-q3.png"
      },
      {
        "sentence": "Переспал и опоздал.",
        "correctWords": ["寝", "すぎて", "遅刻した"],
        "distractors": ["遊び", "暑", "気にし"],
        "image": "/images/test-questions/sugiru-q4.png"
      }
    ],
    "resultMessages": {
      "perfect": {
        "main": "やばい! Все «слишком» собраны верно. すぎる — теперь твой!",
        "sub": "Теперь сможешь жаловаться по-японски: 辛すぎる, 食べすぎた, 高すぎて買えない. やばすぎ!"
      },
      "partial": {
        "main": "Хорошо! Пару конструкций с すぎる стоит повторить — ты уже на верном пути.",
        "sub": "Ещё немного практики — и すぎる станет твоим."
      },
      "fail": {
        "main": "Не сдавайся! Перечитай статью и попробуй ещё раз. 頑張って!",
        "sub": "Каждый пример из статьи приближает к чувству すぎる — когда всего слишком много."
      }
    }
  },
  "related": [
    { "slug": "tai-hoshii", "image": "/images/covers/tai-hoshii.png", "tags": ["Грамматика", "Манга"], "title": "〜たい、〜ほしい、〜てほしい", "description": "Как говорить о своих желаниях." },
    { "slug": "te-forma", "image": "/images/covers/te-forma.png", "tags": ["Грамматика", "Манга"], "title": "て-форма: главное комбо", "description": "Соединять действия, просить, описывать процесс." },
    { "slug": "chasticy-wa-i-ga", "image": "/images/covers/chasticy-wa-i-ga.png", "tags": ["Грамматика", "Манга"], "title": "Война миров: は vs が", "description": "Кто главный в предложении?" }
  ]
}
