{
  "slug": "tai-hoshii",
  "type": "grammar",
  "title": "〜たい、〜ほしい、〜てほしい: как говорить о своих желаниях",
  "image": "/images/covers/tai-hoshii.png",
  "cover": "/images/covers/tai-hoshii.png",
  "backHref": "/",
  "toc": [
    { "id": "intro", "label": "Введение" },
    { "id": "tai", "label": "〜たい — «я хочу сделать»" },
    { "id": "hoshii", "label": "〜ほしい — «я хочу вещь»" },
    { "id": "tehoshii", "label": "〜てほしい — «я хочу, чтобы ты сделал»" },
    { "id": "raznica", "label": "Разница и нюансы" },
    { "id": "primery", "label": "Примеры из жизни" },
    { "id": "test", "label": "Проверка себя" }
  ],
  "links": [{ "href": "#", "label": "Конспект" }],
  "introduction": "Хотеть — не вредно. В японском есть целая система для выражения желаний. Хочешь что-то сделать сам? Хочешь, чтобы это сделал другой? Хочешь вещь? Для всего свои конструкции. Разбираемся на примерах.",
  "tags": ["Грамматика", "Манга"],
  "blocks": [
    {
      "id": "tai",
      "title": "〜たい — «я хочу сделать»",
      "paragraphs": [
        "«食べたい» — «хочу есть». «飲みたい» — «хочу пить». «行きたい» — «хочу пойти». В «Наруто» Наруто кричит: 「火影になりたい!」 — «Я хочу стать Хокаге!». Его мечта — основа всей истории.",
        "«何をしたい?» — «Что хочешь делать?». Полезный вопрос.",
        "Объект желания часто маркируется частицей が, не を. 「水が飲みたい» — «хочу воды». Запомни эту особенность."
      ],
      "construction": "[Основа глагола] + たい"
    },
    {
      "id": "hoshii",
      "title": "〜ほしい — «я хочу вещь»",
      "paragraphs": [
        "«新しいスマホがほしい» — «Хочу новый телефон». Простое желание обладать. «彼女がほしい» — «Хочу девушку». Классическое сетование холостяков в аниме.",
        "«何がほしい?» — «Что хочешь?». Прямой вопрос о желаниях.",
        "В отличие от «たい», здесь речь всегда о предмете, а не о действии. Хочешь вещь — используй «ほしい»."
      ],
      "construction": "[Существительное] + が + ほしい"
    },
    {
      "id": "tehoshii",
      "title": "〜てほしい — «я хочу, чтобы ты сделал»",
      "paragraphs": [
        "«手伝ってほしい» — «Хочу, чтобы ты помог». Просьба, но мягче, чем приказ. «来てほしい» — «Хочу, чтобы ты пришёл». Ждёшь кого-то. «わかってほしい» — «Хочу, чтобы ты понял». Часто в романтических сценах, когда персонаж страдает.",
        "В «Клинке…» Тандзиро говорит: 「妹を人間に戻してほしい」 — «Я хочу, чтобы мою сестру вернули в человека». Цель всего путешествия."
      ],
      "construction": "[Глагол в て-форме] + ほしい"
    },
    {
      "id": "raznica",
      "title": "Разница и нюансы",
      "paragraphs": [
        "«したい» — только про себя. Нельзя сказать «彼は行きたい» о другом человеке напрямую. Только если добавить «と言っている» (он сказал, что хочет). «ほしい» — про свои желания. «新しい車がほしい» — только про себя.",
        "«てほしい» — про желание, чтобы другой сделал что-то. «彼に来てほしい» — «хочу, чтобы он пришёл».",
        "Есть форма «〜たがっている» для желаний других людей. «彼は行きたがっている» — «он хочет пойти» (видно по поведению)."
      ],
      "construction": "[Желание к себе] vs [Желание к другим]"
    },
    {
      "id": "primery",
      "title": "Примеры из жизни",
      "paragraphs": [
        "«夏休みに沖縄へ行きたい» — «Хочу поехать на Окинаву летом». Мечта о путешествии. «新しいバッグがほしい» — «Хочу новую сумку». Шопинг-желание. «彼に優しくしてほしい» — «Хочу, чтобы он был ко мне добрее». Драма в отношениях.",
        "«何をしたいかわからない» — «Не знаю, чего хочу». Экзистенциальный кризис по-японски.",
        "«ずっと一緒にいてほしい» — «Хочу, чтобы ты всегда был рядом». Романтичное признание."
      ],
      "construction": "Все три формы в действии"
    }
  ],
  "test": {
    "type": "grammar",
    "instruction": "Соберите предложение",
    "resultImage": "/images/test-questions/tai-hoshii-result.png",
    "questions": [
      {
        "sentence": "Хочу есть.",
        "correctWords": ["食べ", "たい"],
        "distractors": ["飲み", "ほしい", "行き"],
        "image": "/images/test-questions/tai-hoshii-q1.png"
      },
      {
        "sentence": "Хочу новый телефон.",
        "correctWords": ["新しい", "スマホ", "が", "ほしい"],
        "distractors": ["食べ", "たい", "て", "ほしい"],
        "image": "/images/test-questions/tai-hoshii-q2.png"
      },
      {
        "sentence": "Хочу, чтобы ты помог.",
        "correctWords": ["手伝って", "ほしい"],
        "distractors": ["食べ", "たい", "が", "新しい"],
        "image": "/images/test-questions/tai-hoshii-q3.png"
      },
      {
        "sentence": "Хочу стать Хокаге! (Наруто)",
        "correctWords": ["火影", "に", "なり", "たい"],
        "distractors": ["ほしい", "手伝って", "が", "食べ"],
        "image": "/images/test-questions/tai-hoshii-q4.png"
      }
    ],
    "resultMessages": {
      "perfect": {
        "main": "やばい! Все желания собраны верно. たい, ほしい и てほしい — теперь твои!",
        "sub": "Теперь сможешь говорить 食べたい, ほしい и てほしい — о своих желаниях и о том, чего хочешь от других."
      },
      "partial": {
        "main": "Хорошо! Пару конструкций желаний стоит повторить — ты уже на верном пути.",
        "sub": "Ещё немного практики — и たい, ほしい, てほしい станут твоими."
      },
      "fail": {
        "main": "Не сдавайся! Перечитай статью и попробуй ещё раз. 頑張って!",
        "sub": "Каждый пример из статьи приближает к чувству たい, ほしい и てほしい — свои желания и желания от других."
      }
    }
  },
  "related": [
    { "slug": "te-forma", "image": "/images/covers/te-forma.png", "tags": ["Грамматика", "Манга"], "title": "て-форма: главное комбо", "description": "Соединять действия, просить, описывать процесс." },
    { "slug": "chasticy-wa-i-ga", "image": "/images/covers/chasticy-wa-i-ga.png", "tags": ["Грамматика", "Манга"], "title": "Война миров: は vs が", "description": "Кто главный в предложении?" },
    { "slug": "rugatelstva-anime", "image": "/images/covers/rugatelstva-anime.png", "tags": ["Лексика", "Аниме"], "title": "Как ругаются в японских аниме", "description": "バカ, くそ, この野郎." }
  ]
}
